{
  "schemaVersion": 1,
  "scenarioId": "reserve-deficit",
  "source": "synthetic",
  "capacityWh": 200,
  "capacityFactor": 0.9,
  "stateOfChargePct": 40,
  "reservePct": 25,
  "uncertaintyPct": 20,
  "segments": [
    {
      "id": "outbound",
      "phase": "outbound",
      "distanceM": 60,
      "speedMps": 0.5,
      "dwellS": 0,
      "motionW": 180,
      "idleW": 60,
      "auxW": 15
    },
    {
      "id": "observation",
      "phase": "task",
      "distanceM": 0,
      "speedMps": 0.5,
      "dwellS": 1800,
      "motionW": 180,
      "idleW": 60,
      "auxW": 15
    },
    {
      "id": "return",
      "phase": "return",
      "distanceM": 60,
      "speedMps": 0.5,
      "dwellS": 0,
      "motionW": 180,
      "idleW": 60,
      "auxW": 15
    }
  ]
}
